{
  "schema_version": 1,
  "id": "11111111-1111-1111-1111-111111111111",
  "source": "template",
  "entry": {
    "exterior_doors": 2,
    "entry_node_id": "entry",
    "entry_side": "south"
  },
  "nodes": [
    { "id": "entry", "type": "entry", "label": "Entry", "department": "Circulation", "area_target_mm2": 4000000, "tags": ["public"] },
    { "id": "living", "type": "living", "label": "Living Room", "department": "Public", "area_target_mm2": 24000000, "area_min_mm2": 16000000, "requires_window": true, "requires_exterior_wall": true, "tags": ["public"] },
    { "id": "dining", "type": "dining", "label": "Dining", "department": "Public", "area_target_mm2": 10000000, "requires_window": true, "tags": ["public"] },
    { "id": "kitchen", "type": "kitchen", "label": "Kitchen", "department": "Service", "area_target_mm2": 12000000, "tags": ["service", "wet"] },
    { "id": "master", "type": "master_bedroom", "label": "Master Bedroom", "department": "Private", "area_target_mm2": 16000000, "area_min_mm2": 11000000, "requires_window": true, "requires_exterior_wall": true, "tags": ["private"] },
    { "id": "bed2", "type": "bedroom", "label": "Bedroom 2", "department": "Private", "area_target_mm2": 12000000, "area_min_mm2": 9000000, "requires_window": true, "tags": ["private"] },
    { "id": "bed3", "type": "bedroom", "label": "Bedroom 3", "department": "Private", "area_target_mm2": 11000000, "area_min_mm2": 9000000, "requires_window": true, "tags": ["private"] },
    { "id": "bath", "type": "bathroom", "label": "Bathroom", "department": "Service", "area_target_mm2": 6000000, "tags": ["service", "wet"] },
    { "id": "ensuite", "type": "ensuite", "label": "Ensuite", "department": "Private", "area_target_mm2": 4000000, "tags": ["private", "wet"] },
    { "id": "hall", "type": "corridor", "label": "Hallway", "department": "Circulation", "area_target_mm2": 8000000 },
    { "id": "laundry", "type": "laundry", "label": "Laundry", "department": "Service", "area_target_mm2": 5000000, "tags": ["service", "wet"] },
    { "id": "garage", "type": "garage", "label": "Garage", "department": "Service", "area_target_mm2": 18000000, "tags": ["service"] }
  ],
  "edges": [
    { "a": "entry", "b": "living", "relation": "connected_open", "weight": 0.9 },
    { "a": "entry", "b": "hall", "relation": "connected_door", "weight": 0.8 },
    { "a": "living", "b": "dining", "relation": "connected_open", "weight": 0.8 },
    { "a": "living", "b": "kitchen", "relation": "connected_open", "weight": 0.7 },
    { "a": "kitchen", "b": "dining", "relation": "adjacent", "weight": 0.7 },
    { "a": "kitchen", "b": "laundry", "relation": "connected_door", "weight": 0.7 },
    { "a": "kitchen", "b": "garage", "relation": "connected_door", "weight": 0.6 },
    { "a": "hall", "b": "master", "relation": "connected_door", "weight": 0.9 },
    { "a": "hall", "b": "bed2", "relation": "connected_door", "weight": 0.9 },
    { "a": "hall", "b": "bed3", "relation": "connected_door", "weight": 0.9 },
    { "a": "hall", "b": "bath", "relation": "connected_door", "weight": 0.8 },
    { "a": "master", "b": "ensuite", "relation": "connected_door", "weight": 0.9 },
    { "a": "bed2", "b": "bath", "relation": "near", "weight": 0.5 },
    { "a": "garage", "b": "entry", "relation": "near", "weight": 0.4 }
  ]
}
